{
    "date": "2022-02-25",
    "patientID": "fdjsajkfvhkcjasjcas",
    "healthcareInstitution": "Ostra sjukhuset",
    "medicalPersonnel": "Lolly Pop",
    "details": "thick throat",
    "diagnoses": ["allergy against birch"],
    "prescriptions": [
        "pollenStopperPill, 2 mg 3 times / day, 4 hrs in between", 
        "pollenStopperSpray 2 pills 2 times / day"
    ]
}